,Title,Date,Summary,Rating,Metascore
245,Save Yourselves!,"Oct 2, 2020","Jack (John Reynolds) and Su (Sunita Mani) are a hip Brooklyn couple who, like many of their friends, find themselves dependent on technology and unable to put down their phones. Fearing their mindless scrolling may impact their connection with each other, they seize the chance to head to an isolated cabin in the woods, vowing to unplug from the outside world for a week. Sheltered from texts and push notifications, they are blissfully unaware that the planet is under attack. As strange events unfold, the couple must figure out a way back to civilization—or what’s left of it.",R,67
246,The Life Ahead,"Nov 13, 2020","In seaside Italy, Madame Rosa (Sophia Loren), a Holocaust survivor with a daycare business, takes in 12-year-old street kid Momo, the boy who recently robbed her. The two loners become each other’s protectors, anchoring an unconventional family.",PG-13,66
247,Nina Wu,"Mar 11, 2020","After toiling for years in bit-parts, aspiring actress Nina Wu (Ke-Xi Wu) finally gets her big break with a leading role in a spy thriller set in the 1960s. The part, which calls for nudity and explicit sex scenes, is made all the more challenging thanks to the director’s unending belittlements. While seemingly on the brink of professional triumph, Nina’s psychological resolve begins to crack under the pressure. As she rushes to her childhood home following a family emergency, Nina begins suffering paranoid fantasies that a mysterious woman is stalking and attacking her. As Nina clings to memories of happier times, it seems that there is one crucial memory that she is repressing.",Unrated,66
248,Mulan,"Sep 4, 2020","When the Emperor of China issues a decree that one man per family must serve in the Imperial Army to defend the country from Northern invaders, Hua Mulan, the eldest daughter of an honored warrior, steps in to take the place of her ailing father. Masquerading as a man, Hua Jun, she is tested every step of the way and must harness her inner-strength and embrace her true potential. It is an epic journey that will transform her into an honored warrior and earn her the respect of a grateful nation…and a proud father. ",TV-PG,66
249,Wander Darkly,"Dec 11, 2020","A traumatic accident leaves a couple, Adrienne (Sienna Miller) and Matteo (Diego Luna), in a surreal state of being that takes them on a disorienting journey through the duality of their shared moments.  By reliving fond recollections from the beginning of their romance while also navigating the overwhelming truths of their present, they must rediscover the love that truly binds them together. ",R,66
250,You Cannot Kill David Arquette,"Aug 21, 2020","Branded as the most hated man in wrestling after winning a highly controversial WCW World Heavyweight Championship in 2000, actor David Arquette attempts a rocky return to the sport that stalled his promising Hollywood career. Dangerously determined to redeem his reputation and reclaim his self-respect, Arquette will stop at nothing to earn his place in professional wrestling.",R,66
251,You Don't Nomi,"Jun 9, 2020","Paul Verhoeven's Showgirls was met by critics and audiences with near universal derision. You Don't Nomi traces the film's redemptive journey from notorious flop to cult classic, and maybe even masterpiece.",Unrated,66
252,Pieces of a Woman,"Dec 30, 2020","Martha (Vanessa Kirby) and Sean (Shia LaBeouf) are a Boston couple on the verge of parenthood whose lives change irrevocably when a home birth ends in unimaginable tragedy. Thus begins a yearlong odyssey for Martha, who must navigate her grief while working through fractious relationships with her husband and her domineering mother (Ellen Burstyn), along with the publicly vilified midwife (Molly Parker), whom she must face in court. ",R,66
253,Tommaso,"Jun 5, 2020","Abel Ferrara’s first dramatic feature since 2014’s Pasolini reteams the filmmaker and his frequent lead Willem Dafoe, who plays the title character, an older American expat living in Rome with his young wife and their daughter. Disoriented by his past misgivings and subsequent, unexpected blows to his self-esteem, Tommaso wades through this late chapter of his life with an increasingly impaired grasp on reality as he prepares for his next film.",Not Rated,66
254,Young Ahmed,"Feb 21, 2020","Despite the desperate protestations of his single mother (Claire Bodson), a Muslim teenager (Idir Ben Addi) in a small Belgian town is being gradually radicalized into extremism.  He winds up hatching a murderous plot targeting his beloved teacher (Myriem Akheddiou). ",Not Rated,66
255,Scare Me,"Oct 1, 2020","Fred (Josh Ruben), a frustrated copywriter, checks in to a winter cabin to start his first novel. While jogging in the nearby woods, he meets Fanny (Aya Cash), a successful and smug young horror author who fuels his insecurities. During a power outage, Fanny challenges Fred to tell a scary story. As a storm sets in, they pass the time spinning spooky tales fueled by the tensions between them, and Fred is forced to confront his ultimate fear: Fanny is the better storyteller. The stakes are raised when they’re visited by a horror fan (Chris Redd) who delivers levity (and a pizza) to the proceedings.",Not Rated,66
256,Becoming,"May 6, 2020","Becoming is an intimate look into the life of former First Lady Michelle Obama during a moment of profound change, not only for her personally but for the country she and her husband served over eight impactful years in the White House. The film offers a rare and up-close look at her life, taking viewers behind the scenes as she embarks on a 34-city tour that highlights the power of community to bridge our divides and the spirit of connection that comes when we openly and honestly share our stories.",PG,66
257,Straight Up,"Feb 28, 2020","Todd is a hyper-articulate, obsessive compulsive gay twentysomething whose fear of dying alone leads him to a baffling conclusion: he might not be gay after all. When he meets Rory, a whip-smart struggling actress with her own set of insecurities, the two forge a relationship that’s all talk and no sex. ",Not Rated,66
258,The Way Back,"Mar 6, 2020","Jack Cunningham (Ben Affleck) once had a life filled with promise. In high school, he was a basketball phenom with a full university scholarship, when suddenly, for reasons unknown, he walked away from the game, forfeiting his future. Now years later, Jack is spiraling down, triggered by an unspeakable loss, and drowning in the alcoholism that cost him his marriage and any hope for a better life.  When he is asked to coach the basketball team at his alma mater, which has fallen far since his glory days, he reluctantly accepts, surprising no one more than himself. As the boys start to come together as a team and win, Jack may have finally found a reason to confront the demons that have derailed him. But will it be enough to fill the void, heal the deep wounds of his past, and set him on the road to redemption? ",R,66
259,A Good Woman Is Hard to Find,"May 8, 2020","Recently widowed mother of two, Sarah (Sarah Bolger). is desperate to know who murdered her husband in front of her young son, rendering him mute. Coerced into helping a low-life drug dealer stash narcotics stolen from the local Mr. Big, she’s forced into taking drastic action to protect her children, evolving from downtrodden submissive to take-charge vigilante. [Film Movement]",Not Rated,65
260,Tigertail,"Apr 10, 2020","Pin-Jui (Hong-Chi Lee) is a free-spirited yet impoverished young Taiwanese factory worker, who makes the difficult decision to leave his homeland — and the woman he loves — behind in order to seek better opportunities in America. But years of monotonous work and an arranged marriage devoid of love or compassion leave an older Pin-Jui (Tzi Ma) a shadow of his former self. Unable to sympathize with his daughter Angela (Christine Ko) and at risk of living out his retirement in solitude, Pin-Jui must reconnect with his past in order to finally build the life he once dreamed of having.",PG,65
261,Pinocchio,"Dec 25, 2020","Shot in stunning Italian locations, Matteo Garrone’s rich world of mystery and wonder stars Academy Award® winning actor Roberto Benigni as Geppetto, the old woodcarver whose puppet creation, Pinocchio, magically comes to life with dreams of becoming a real boy.  Easily led astray, Pinocchio (nine-year-old Federico Ielapi) tumbles from one misadventure to another as he is tricked, kidnapped and chased by bandits through a wonderful world full of imaginative creatures – from the belly of a giant fish, to the Land Of Toys and the Field Of Miracles.",PG-13,65
262,Bill & Ted Face the Music,"Aug 28, 2020","When we last met Bill and Ted they were time-traveling teenagers trying to pass history class and win the battle of the bands. Once prophesized to save the universe with their rock and roll, middle age and the responsibilities of family have caught up with these two best friends who have not yet fulfilled their destiny. They’ve written thousands of tunes, but they have yet to write a good one, much less the greatest song ever written. With the fabric of time and space tearing around them, a visitor from the future warns our heroes that only their song can save life as we know it. Out of luck and fresh out of inspiration, Bill and Ted set out on a time travel adventure to seek the song that will set their world right and bring harmony in the universe as we know it. Together with the aid of their daughters, a new crop of historical figures, and some sympathetic music legends, Bill and Ted find much, much more than just a song.",PG-13,65
263,A Call to Spy,"Oct 2, 2020","As Great Britain’s forces were stretched thin during World War II, Winston Churchill’s Special Operations Executive (SOE) began to enlist women as spies. Their daunting mission: conduct sabotage and build a resistance. Spymistress Vera Atkins, later the inspiration for Ian Fleming’s Miss Moneypenny in the James Bond franchise, was the chief recruiter for this secret army. Atkins selected two unusual candidates: Virginia Hall, an American journalist from Baltimore hampered by a wooden leg, and Noor Inayat Khan, a wireless officer of Indian descent and an avowed pacifist. Together, they worked to undermine the Nazi regime in France. The courage, sacrifices and grit of these three women helped quell the Nazi occupation – and ultimately turned the tide of the war.",PG-13,65
264,Critical Thinking,"Sep 4, 2020","Based on a true story from 1998, five LatinX and Black teenagers from the toughest underserved ghetto in Miami fight their way into the National Chess Championship under the guidance of their unconventional but inspirational teacher.",Not Rated,65
265,Bull,"May 1, 2020","After trashing her neighbor's house in a fit of youthful defiance, 14-year-old Kris (Amber Havard) seems destined to follow in her mother's footsteps to the state penitentiary. To make amends, she is forced to help Abe Turner (Rob Morgan), an ex-bull rider scraping by on the Texas rodeo circuit, with errands at home and at his work. While traveling with Abe, she discovers a passion for bull riding.  Yet, as Kris sets out to learn the dangerous sport, bad influences lure her back into delinquent ways. Meanwhile, Abe struggles with the aches and pains of growing older and aging out of the only life he has ever known. Together, Kris and Abe forge an unexpected connection, helping each other see new possibilities and hope for the future before it’s too late.",Not Rated,65
266,Creem: America's Only Rock 'n' Roll Magazine,"Aug 7, 2020","Capturing the messy upheaval of the '70s just as rock was re-inventing itself, the film explores CREEM Magazine's humble beginnings in post-riot Detroit, follows its upward trajectory from underground paper to national powerhouse - spotlighting iconic features, interviews, and anecdotes along the way - then bears witness to its imminent demise following the tragic and untimely deaths of its visionary publisher, Barry Kramer, and its most famous alum and genius clown prince, Lester Bangs, a year later. Fifty years after publishing its first issue, ""America's Only Rock 'n' Roll Magazine"" remains a seditious spirit in music and culture.",TV-MA,65
267,Helmut Newton: The Bad and the Beautiful,"Jul 24, 2020","One of the great masters of photography, Helmut Newton made a name for himself exploring the female form, and his cult status continues long after his tragic death in a Los Angeles car crash in 2004. Newton worked around the globe, from Singapore to Australia to Paris to Los Angeles, but Weimar Germany was the visual hallmark of his work. Newton's unique and striking way of depicting women has always posed the question: did he empower his subjects or treat them as sexual objects? [Kino Lorber]",Unrated,65
268,Miss Americana,"Jan 31, 2020",A look at iconic pop artist Taylor Swift during a transformational time in her life as she embraces her role as a singer/songwriter and harnesses the full power of her voice.,TV-MA,65
269,The Audition,"Jun 26, 2020","Anna Bronsky is a violin teacher at a music-focused high school. Despite the opposition of all other teachers, Anna drives through the admission of a student, Alexander, in whom she detects a remarkable  talent. Committed, she prepares him for the intermediate exam and neglects her family – her son Jonas, whom she brings into competition with her new student, and her husband Philippe. Her colleague Christian, with whom she has an affair, persuades her to join a quintet. When she fails during their joint concert, the pressure mounts and she focuses all her attention on her student Alexander. Come the day of the exam, events take a tragic turn.",Not Rated,65
270,Aviva,"Jun 12, 2020","The character of Aviva, played by both Zina Zinchenko (and at times by Or Schraiber), is a young Parisian who develops an online romance with Eden, played by Tyler Phillips (and at times Bobbie Jene Smith), a New Yorker. After a long courtship they meet in person and fall in love, settling into an intimate relationship that leads to marriage, but one, as many are, laced with conflicts. Incorporating exuberant dance sequences, and featuring a pair of principal characters played by four different actors daringly expressing both masculine and feminine sides, “Aviva” captures a restless and changing today where who we are as women and men, and how we navigate the world, is up for grabs.",Unrated,65
271,Ride Your Wave,"Feb 19, 2020","Hinako is a surf-loving college student who has just moved to a small seaside town. When a sudden fire breaks out at her apartment building, she is rescued by Minato, a handsome firefighter, and the two soon fall in love. Just as they become inseparable, Minato loses his life in an accident at sea. Hinako is so distraught that she can no longer even look at the ocean, but one day she sings a song that reminds her of their time together, and Minato appears in the water. From then on, she can summon him in any watery surface as soon as she sings their song, but can the two really remain together forever? And what is the real reason for Minato's sudden reappearance?",Not Rated,65
272,Swallow,"Mar 6, 2020","On the surface, Hunter (Haley Bennett) appears to have it all. A newly pregnant housewife, she seems content to spend her time tending to an immaculate home and doting on her Ken-doll husband, Richie (Austin Stowell). However, as the pressure to meet her controlling in-laws and husband's rigid expectations mounts, cracks begin to appear in her carefully created facade. Hunter develops a dangerous habit, and a dark secret from her past seeps out in the form of a disorder called pica - a condition that has her compulsively swallowing inedible, and oftentimes life-threatening, objects. [IFC Midnight]",R,65
273,Gretel & Hansel,"Jan 31, 2020","A long time ago in a distant fairytale countryside, a young girl (Sophia Lillis) leads her little brother (Sammy Leakey) into a dark wood in desperate search of food and work, only to stumble upon a nexus of terrifying evil. ",PG-13,64
274,The Eight Hundred,"Aug 28, 2020","From the acclaimed filmmaker behind Mr. Six comes a riveting war epic. In 1937, eight hundred Chinese soldiers fight under siege from a warehouse in the middle of the Shanghai battlefield, completely surrounded by the Japanese army.",Not Rated,64
275,The Other Lamb,"Apr 3, 2020","For her entire life, the cult she was born into has been all that teenage Selah (Raffey Cassidy) has known. Along with a band of similarly cloistered young women she lives seemingly unstuck in time, cut off from modern society in a remote forest commune presided over by a man called Shepherd (Michiel Huisman), a controlling, messiah-like figure with a frightening dark side. But when her insular world is rocked by a series of nightmarish visions and disturbing revelations, Selah begins to question everything about her existence—including her allegiance to the increasingly dangerous Shepherd. [IFC Midnight]",Unrated,64
276,Vivarium,"Mar 27, 2020","Tom and Gemma (Jesse Eisenberg and Imogen Poots) are looking for the perfect home. When a strange real-estate agent takes them to Yonder, a mysterious suburban neighborhood of identical houses, Tom and Gemma can’t leave quick enough. But when they try to exit the labyrinth-like housing development, each road takes them back to where they started. Soon, they realize their search for a dream home has plunged them into a terrifying nightmare.",R,64
277,Come to Daddy,"Feb 7, 2020",A man in his thirties travels to a remote cabin to reconnect with his estranged father.,TV-14,64
278,Big Time Adolescence,"Mar 13, 2020","A suburban teenager comes of age under the destructive guidance of his best friend, an aimless college dropout.",R,64
279,Spelling the Dream,"Jun 3, 2020","Spelling the Dream explores the near two decade trend of Indian American students dominating the Scripps National Spelling Bee. Since 1999, 19 out of the 23 winners have been of South-Asian descent, including the last 11 in a row. Over the course of a year leading up to the 2017 Scripps Bee, ""Breaking the Bee"" follows four Indian-American children of different ages to learn about their family life, witness them train, explore the ups and downs of chasing a dream, and offer a candid look at what it really takes to become the best. These students are not against each other. They are against the dictionary. Come the national finals, who will be the winner standing on stage as confetti rains down, and how long will this trend last?",TV-G,64
280,Us Kids,"Oct 30, 2020","Sparked by the plague of gun violence ravaging their schools, Us Kids chronicles the March For Our Lives movement over several years. The documentary follows Emma Gonzalez, David Hogg, Cameron Kasky, Samantha Fuentes, gun violence survivors, and teenage activists as they pull together the largest youth protest in American history. Their movement went global with rallies on six continents and in over 700 cities in every state across the nation, expanding to address racial injustice, a growing public health crisis, and shocking a political system into change. ",Not Rated,64
281,All Together Now,"Aug 28, 2020","Amber Appleton (Auli’i Cravalho) remains an optimist even when her personal life is far less stable than it appears on the surface. A musically gifted high school student with aspirations to attend Carnegie Mellon, Amber balances her beloved high school drama club helmed by Mr. Franks (Fred Armisen) with working long hours at a donut shop to help support herself and her down-on-her-luck single mom (Justina Machado). She also spends time at the local retirement community, giving care and attention to her favorite pessimistic resident (Carol Burnett). When new obstacles present themselves that threaten her dreams, Amber must learn to lean on the strength of her chosen family to move forward.",PG,64
282,The Beach House,"Jul 9, 2020","Escaping to his family’s beach house to reconnect, Emily and Randall find their off-season trip interrupted by Mitch and Jane Turner, an older couple acquainted with Randall’s estranged father. Unexpected bonds form as the couples let loose and enjoy the isolation, but it all takes an ominous turn as increasingly strange environmental phenomena begin to warp their peaceful evening. As the effects of an infection become evident, Emily struggles to make sense of the contagion before it’s too late.

",Not Rated,64
283,Skin: A History of Nudity in the Movies,"Aug 18, 2020","A definitive documentary on the history of nudity in the movies, beginning with the silent movie era through present day, examining the changes in morality that led to the use of nudity in films while emphasizing the political, sociological and artistic changes that shaped this rich history.  Skin delves  into the gender bias concerning nudity in motion pictures and will follow the revolution that has pushed for gender equality in feature films today. A deep discussion of pre-code Hollywood and its amoral roots, the censorship that “cleaned up” Hollywood and how the MPAA was formed leads into a discussion of how nudity changed cinematic culture through the decades. It culminates in a discussion of “what are nude scenes like in the age of the #METOO movement?”",Not Rated,64
284,The Traitor,"Jan 31, 2020","In the early 1980’s, an all out war rages between Sicilian mafia bosses over the heroin trade. Tommaso Buscetta, a made man, flees to hide out in Brazil. Back home, scores are being settled and Buscetta watches from afar as his sons and brother are killed in Palermo, knowing he may be next. Arrested and extradited to Italy by the Brazilian police, Buscetta makes a decision that will change everything for the Mafia: He decides to meet with Judge Giovanni Falcone and betray the eternal vow he made to the Cosa Nostra.",R,64
285,Greenland,"Dec 18, 2020","A family fights for survival as a planet-killing comet races to Earth.  John Garrity (Gerard Butler), his estranged wife Allison (Morena Baccarin), and young son Nathan make a perilous journey to their only hope for sanctuary.  Amid terrifying news accounts of cities around the world being leveled by the comet’s fragments, the Garrity’s experience the best and worst in humanity while they battle the increasing panic and lawlessness surrounding them.  As the countdown to global apocalypse approaches zero, their incredible trek culminates in a desperate and last-minute flight to a possible safe haven.",PG-13,64
286,The Lodge,"Feb 7, 2020","A family retreats to their remote winter cabin over the holidays. When the father (Richard Armitage) is forced to abruptly depart for work, he leaves his children, Aidan (Jaeden Martell) and Mia (Lia McHugh) in the care of his new girlfriend, Grace (Riley Keough). Isolated and alone, a blizzard traps them inside the lodge as terrifying events summon specters from Grace’s dark past.",R,64
287,Greyhound,"Jul 10, 2020","In the early days of WWII, an international convoy of 37 Allied ships, led by captain Ernest Krause (Tom Hanks) in his first command of a U.S. destroyer, crosses the treacherous North Atlantic while hotly pursued by wolf packs of Nazi U-boats.",PG-13,64
288,Synchronic,"Oct 23, 2020","When New Orleans paramedics and longtime best friends Steve (Anthony Mackie) and Dennis (Jamie Dornan) are called to a series of bizarre, gruesome accidents, they chalk it up to the mysterious new party drug found at the scene. But after Dennis’s oldest daughter suddenly disappears, Steve stumbles upon a terrifying truth about the supposed psychedelic that will challenge everything he knows about reality—and the flow of time itself.",R,64
289,I'm Your Woman,"Dec 4, 2020","In this 1970s set crime drama, a woman is forced to go on the run after her husband betrays his partners, sending her and her baby on a dangerous journey.",R,63
290,Banana Split,"Mar 27, 2020","April (Hannah Marks) has spent the last two years of high school in a relationship with Nick (Dylan Sprouse), from first frantic make-out session to final tear-stained breakup. In the aimless summer between graduation and college, the newly single April mends her heartbreak by striking up an unexpected friendship with an unlikely candidate: Nick’s new girlfriend, Clara (Liana Liberato).",R,63
291,Blood on Her Name,"Feb 28, 2020",A woman's panicked decision to cover up an accidental killing spins out of control when her conscience demands she return the dead man's body to his family.,Not Rated,63
292,Blood Quantum,"Apr 28, 2020","The dead are coming back to life outside. But in the isolated Mi'gmaq reserve of Red Crow, the indigenous inhabitants are immune to the zombie plague. Traylor, the tribal sheriff, must protect his son's pregnant girlfriend, apocalyptic refugees and reserve riffraff from the hordes of walking white corpses. [Shudder]",Not Rated,63
293,Let Him Go,"Nov 6, 2020","Following the loss of their son, retired sheriff George Blackledge (Kevin Costner) and his wife Margaret (Diane Lane) leave their Montana ranch to rescue their young grandson. When they discover that he is in the clutches of a dangerous family living off the grid in the Dakotas, George and Margaret must fight for the survival of their family.",R,63
