,Title,Date,Summary,Rating,Metascore
391,Clouds,"Oct 16, 2020","Based on an incredible true story, seventeen-year-old Zach Sobiech is a fun-loving high school senior with raw musical talent. But a few weeks into his senior year, just as his dream girl finally reciprocates his crush, Zach’s world gets turned upside down when he finds out his cancer has spread, and he now has only six months to live. With the limited time he has left, he and his best friend and writing partner, Sammy, decide to follow their dreams and finally make an album. Little did they know; the world would soon catch on and they would become a viral phenomenon. With time running out, Zach is confronted with the reality that no matter how he spends his time, he is going to hurt the people he loves the most, including the love of his life Amy. As Zach’s health condition begins to worsen, he is left to make difficult decisions about how to spend his time and more importantly with whom. Ultimately, he discovers the best way to say goodbye is with music, and his hit song Clouds is born. With a raw, unfiltered and beautiful look at the heartbreaking duality of life set to uplifting music, Zach’s inspiring story is a testament to what can happen when you start to live as if each day might be your last.",TV-PG,55
392,The Prom,"Dec 4, 2020","Dee Dee Allen (Meryl Streep) and Barry Glickman (James Corden) are New York City stage stars with a crisis on their hands: their expensive new Broadway show is a major flop that has suddenly flatlined their careers. Meanwhile, in small-town Indiana, high school student Emma Nolan (Jo Ellen Pellman) is experiencing a very different kind of heartbreak: despite the support of the high school principal (Keegan-Michael Key), the head of the PTA (Kerry Washington) has banned her from attending the prom with her girlfriend, Alyssa (Ariana DeBose). When Dee Dee and Barry decide that Emma's predicament is the perfect cause to help resurrect their public images, they hit the road with Angie (Nicole Kidman) and Trent (Andrew Rannells), another pair of cynical actors looking for a professional lift. But when their self-absorbed celebrity activism unexpectedly backfires, the foursome find their own lives upended as they rally to give Emma a night where she can truly celebrate who she is.",PG-13,55
393,Tammy's Always Dying,"May 1, 2020","On the 29th of every month, when the welfare runs out, Catherine talks her alcoholic mother off of the same bridge. Literally. Catherine, a connoisseur of bad decisions, dreams of being successful. At anything. Tammy, her mother, has been so poor for so long all she can do is party about it. When Tammy is diagnosed with terminal cancer Catherine is forced to move in and care for her. Enter Ilana, a glamorous purveyor of talk-show tragedy porn who wants to help Catherine publish her life story. Caught between sacrifice and selling out, Catherine must decide if life without Tammy is really a better life.",Not Rated,55
394,Kindred,"Nov 6, 2020","Vulnerable mother-to-be Charlotte (Tamara Lawrance) is taken in by her recently deceased boyfriend’s mother (Fiona Shaw) and her stepson (Jack Lowden), who seem increasingly obsessed with her every move. Plagued by mysterious hallucinations, Charlotte’s suspicions grow about Margaret and Thomas’ intentions for her unborn child.",Not Rated,55
395,To All the Boys: P.S. I Still Love You,"Feb 12, 2020","It's a new year and Lara Jean (Lana Condor) and Peter (Noah Centineo) are no longer pretending to be a couple. They ARE a couple. And, as Lara Jean navigates a trove of official firsts with Peter - her first real kiss, her first real date, her first Valentine's Day - she finds herself leaning more on Kitty and Margot (Anna Cathcart and Janel Parrish), Chris (Madeleine Arthur), and an unexpected new confidant, Stormy (Holland Taylor), to help her manage the complex emotions that come with this new chapter of balancing a relationship and figuring out her authentic self. But when John Ambrose (Jordan Fisher), another recipient of one of Lara Jean's old love letters, enters her life again she must rely on herself more than ever as she's confronted with her first real dilemma: Can a girl be in love with two boys at once?",TV-14,54
396,I Am Woman,"Sep 11, 2020","In 1966, single-mother Helen Reddy  (Tilda Cobham-Hervey) leaves her old life in Australia for New York and stardom, only to find that the industry’s male gatekeepers don’t take her seriously.  Helen finds an encouraging friend in legendary rock journalist Lillian Roxon (Danielle Macdonald), who becomes her closest confidant.  When ambitious aspiring talent manager Jeff Wald (Evan Peters) sweeps Helen off her feet, everything changes as he becomes both her husband and manager and relocates the family to California.  With a strong push from Helen, Jeff secures her a recording contract and subsequent string of hit singles, including the iconic megahit “I Am Woman.”  Increased fame leads to added pressures on themselves and their relationship, forcing Helen to find the strength to take control of her own destiny.",TV-MA,54
397,Wasp Network,"Jun 19, 2020",René González (Edgar Ramírez) is a Cuban pilot who leaves his wife (Penelope Cruz) and young daughter behind in the communist island nation to defect to the United States and begin a new life of freedom in the early 1990s. But René is not the upstart American striver he appears to be. Joining forces with a group of Cuban exiles in South Florida known as the Wasp Network — led by undercover operative Manuel Viramontez a.k.a. Gerardo Hernandez (Gaël García Bernal) — he becomes part of a pro-Castro spy ring tasked with observing and infiltrating Cuban-American terror groups intent upon attacking the socialist republic.,TV-MA,54
398,The Cuban,"Jul 31, 2020","When a pre-med student gets her first job in a nursing home, an unexpected friendship with Luis (Louis Gossett Jr.), an elderly Cuban musician, reignites her love of music and changes her life forever.",Not Rated,54
399,The Craft: Legacy,"Oct 28, 2020",An eclectic foursome of aspiring teenage witches get more than they bargained for as they lean into their newfound powers.,PG-13,54
400,Becky,"Jun 5, 2020","Spunky and rebellious, Becky (Lulu Wilson) is brought to a weekend getaway at a lake house by her father Jeff (Joel McHale) in an effort to try to reconnect. The trip immediately takes a turn for the worse when a group of convicts on the run, led by the merciless Dominick (Kevin James), suddenly invade the lake house.",R,54
401,Evil Eye,"Oct 13, 2020",A seemingly perfect romance turns into a nightmare when a mother becomes convinced her daughter’s new boyfriend has a dark connection to her own past.,Not Rated,54
402,Blackbird,"Sep 18, 2020","Lily (Susan Sarandon) and Paul (Sam Neill) summon their loved ones to their beach house for one final gathering after Lily decides to end her long battle with ALS. The couple is planning a loving weekend complete with holiday traditions, but the mood becomes strained when unresolved issues surface between Lily and her daughters Jennifer (Kate Winslet) and Anna (Mia Wasikowska). Joining the collective farewell are Lily’s son in law (Rainn Wilson), her lifelong friend (Lindsay Duncan), daughter’s partner (Bex Taylor-Klaus) and grandson (Anson Boon). ",R,53
403,The Artist's Wife,"Sep 25, 2020","Claire (Lena Olin) lives a quiet domestic life in the Hamptons as the wife of celebrated artist Richard Smythson (Bruce Dern). Once a promising painter herself, Claire now lives in the shadow of her husband’s illustrious career. While preparing work for his final show, Richard’s moods become increasingly erratic, and he is diagnosed with dementia. As his memory and behavior deteriorate, she shields his condition from the art community while trying to reconnect him with his estranged daughter and grandson from a previous marriage. Challenged by the loss of her world as she knew it, Claire must now decide whether to stand with Richard on the sidelines or step into the spotlight herself.",R,53
404,Space Dogs,"Sep 11, 2020","Laika, a stray dog picked up by the Soviet space program on the streets of Moscow, became the first living being to orbit the earth when she was launched into space on Sputnik 2. Although Laika would not survive the journey, directors Elsa Kremser and Levin Peter trace the persistence of her memory and legacy into the present day. As the capsule containing Laika re-entered Earth’s orbit and began to burn up, the narrator announces “What had been a Moscow street dog had become a ghost.”  The ghost Laika lives on in the present-day strays of Space Dogs. Photographed at ground level with wandering, hypnotic camera movements, the strays are seen navigating the urban environs of modern Moscow. In hewing closely to the dog’s point of view, the city is rendered as a strange, alien environment. Pulsating music from buildings and unidentified passerby take on an unfamiliar quality as the dogs explore this strange new world. [Icarus Films]",Not Rated,53
405,Balloon,"Feb 21, 2020","In the summer of 1979, the Strelzyk and Wetzel families—who had been working on their audacious plan for more than two years—try to flee East Germany in a self-made hot-air balloon. But after the balloon crash-lands just before the West German border, the Stasi find traces of the attempted escape and immediately launch an investigation. In a nerve-wracking race against the clock, the two families attempt to build a new escape balloon as the Stasi get closer and closer each day.",PG-13,53
406,Jungleland,"Nov 6, 2020","Stan (Charlie Hunnam) and Lion (Jack O’Connell) are two brothers struggling to stay relevant in the underground world of bare-knuckle boxing. When Stan fails to pay back a dangerous crime boss (Jonathon Majors), they’re forced to deliver an unexpected traveler as they journey across the country for a high-stakes fighting tournament. While Stan trains Lion for the fight of his life, a series of events threaten to tear the brothers apart but their love for one another and belief in a better life keep them going.",R,53
407,On a Magical Night,"May 8, 2020","After a heated argument with her husband of 20 years, Maria, a woman with a wandering eye, spends the night in room 212 of the hotel across the street from their home. There, she has a bird’s eye view of her apartment, her husband, and her marriage. In this comic romp from writer-director Christophe Honoré, she confronts her past lovers and relationships on one magical night, fantasizing about the lives she could’ve lived and wondering if she’s made the right decisions.",Not Rated,53
408,Resistance,"Mar 27, 2020","Before he was the world-famous mime Marcel Marceau, he was Marcel Mangel, an aspiring Jewish actor who joined the French Resistance to save the lives of thousands of children orphaned at the hands of the Nazis. As a young man growing up in Nazi-occupied Europe, Marcel (Jesse Eisenberg ) has no intention of getting involved in the war – his pursuits include impersonating Charlie Chaplin in burlesque clubs, painting backdrops for his plays, and antagonizing his obstinate father. His life is thrown into upheaval when he is recruited into the French Resistance, putting his acting skills to the ultimate test in teaching orphaned Jewish children how to survive in the horrifying reality of the Holocaust.",R,53
409,69: The Saga of Danny Hernandez,"Nov 16, 2020","Part investigative documentary, part real-life gangster movie, 69: The Saga of Danny Hernandez unpacks the life of polarizing rap sensation and internet troll Tekashi69. One of the most controversial figures in contemporary pop culture, 69 repeatedly broke the internet with his sensationalist music videos and social media beefs before infamously testifying against Brooklyn gang the Nine Trey Gangsta Bloods in a landmark trial. [Hulu]",TV-MA,53
410,Valley Girl,"May 8, 2020","Set to a new wave '80s soundtrack, a pair of young lovers from different backgrounds defy their parents and friends to stay together. A musical adaptation of the 1983 film.",PG-13,53
411,The Quarry,"Apr 17, 2020","After murdering a traveling preacher, a fugitive drifter (Shea Whigham) travels to a small town and poses as the man he killed. Though the congregation loves the drifter’s sermons of forgiveness, the local police chief (Michael Shannon) is suspicious of the man. Soon a gruesome discovery at a local quarry forces the killer to fight for his freedom.",R,53
412,Guest of Honour,"Jul 10, 2020","Jim (David Thewlis) and his daughter Veronica (Laysla De Oliveira), a high school music teacher, attempt to unravel their complicated histories and intertwined secrets in the latest film from Atom Egoyan (The Sweet Hereafter), which weaves through time exploring perception and penance, memory and forgiveness. A hoax instigated by an aggressive school bus driver (Rossif Sutherland) goes very wrong. Accused of abusing her position of authority with 17-year-old Clive (Alexandre Bourgeois) and another student, Veronica is imprisoned. Convinced that she deserves to be punished for crimes she committed at an earlier age, Veronica rebuffs her father’s attempts to secure her early release. Confused and frustrated by her intransigence, Jim's anguish begins to impinge on his job. As a food inspector, he wields great power over small, family-owned restaurants. It’s a power he doesn’t hesitate to use. While preparing Jim's funeral, Veronica confides the secrets of her past to Father Greg (Luke Wilson), who may hold the final piece of this father-daughter puzzle. [Kino Lorber]",Not Rated,53
413,Castle in the Ground,"May 15, 2020","A grieving teenager (Alex Wolff) befriends his charismatic but troubled next-door neighbor (Imogen Poots), only to become ensnared in a world of addiction and violence as the opioid epidemic takes hold of their small town.",TV-MA,53
414,Tesnota (Closeness),"May 1, 2020","1998, Nalchik, the North Caucasus, Russia. 24-year-old Ilana works in her father’s garage to help him make ends meet. One evening, her extended family and friends gather to celebrate the engagement of her younger brother David. Later that night, the young couple is kidnapped, and a ransom demand delivered. In this close-knit Jewish enclave, involving the police is out of the question. How will the family raise the money to save David? Ilana and her parents, each in their own way, will go as far as necessary, whatever the risks to themselves.",Not Rated,53
415,Hubie Halloween,"Oct 7, 2020","Hubie Dubois (Adam Sandler) thanklessly spends every Halloween making sure the residents of his hometown, Salem, celebrate safely and play by the rules. But this year, an escaped criminal and a mysterious new neighbor have Hubie on high alert. When people start disappearing, it’s up to Hubie to convince the police (Kevin James, Kenan Thompson) and townsfolk that the monsters are real, and only he can stop them.",PG-13,53
416,Black Beauty,"Nov 27, 2020","This modern day reimagining of Anna Sewell’s timeless classic, follows Black Beauty (voiced by Kate Winslet), a wild horse born free in the American West. Rounded up and taken away from her family, Beauty is brought to Birtwick Stables where she meets a spirited teenage girl, Jo Green (Mackenzie Foy). Beauty and Jo forge an unbreakable bond that carries Beauty through the different chapters, challenges, and adventures of her life.",TV-PG,52
417,VHYes,"Jan 12, 2020","A bizarre retro comedy shot entirely on VHS, VHYes takes us back to a simpler time, when twelve-year-old Ralph mistakenly records home videos and his favorite late night shows over his parents’ wedding tape. The result is a nostalgic wave of home shopping clips, censored pornography, and nefarious true-crime tales that threaten to unkindly rewind Ralph’s reality. [Oscilloscope]",Not Rated,52
418,Greed,"Feb 28, 2020","Self-made British billionaire Sir Richard McCreadie's (Steve Coogan) retail empire is in crisis. For 30 years he has ruled the world of retail fashion – bringing the high street to the catwalk and the catwalk to the high street – but after a damaging public inquiry, his image is tarnished. To save his reputation, he decides to bounce back with a highly publicized and extravagant party celebrating his 60th birthday on the Greek island of Mykonos. ",R,52
419,A Girl Missing,"Jul 31, 2020","Ichiko is a private home-nurse who has worked for the elder matriarch of the Oishos for years and regards them as her own family. Ichiko's quiet, routine life is shattered when a young member of the Oishos clan is kidnapped. When it is revealed that the kidnapper is none other than Ichiko’s nephew, her life begins to unravel.",Not Rated,52
420,Waiting for the Barbarians,"Aug 7, 2020","The Magistrate (Mark Rylance) of an isolated frontier settlement on the border of an unnamed empire looks forward to an easy retirement until the arrival of Colonel Joll (Johnny Depp), whose task it is to report on the activities of the ‘barbarians’ and on the security situation on the border. Joll conducts a series of ruthless interrogations, which leads the Magistrate to question his loyalty to the empire.

",Not Rated,52
421,The Big Ugly,"Jul 24, 2020","Neeyln (Vinnie Jones) has always been the loyal enforcer for crime boss Harris (Malcolm McDowell) back in London, taking care of problems and people that disrupt his illicit business. When Harris strikes a deal with an old friend – American oilman Preston (Ron Perlman) – they find themselves in the wild hills of West Virginia. Contracts are signed and the whiskey flows in celebration, but overnight Neelyn’s girlfriend disappears, last seen with Preston’s wayward son Junior. Lines are drawn between family and friends, but nothing will stop Neelyn from getting answers — and retribution. ",R,52
422,The Main Event,"Apr 10, 2020","When 11-year-old Leo Thompson (Seth Carr) discovers a magical wrestling mask that grants him super strength, he uses it to enter a WWE competition. With the support of his grandmother (Tichina Arnold), Leo will do whatever it takes to achieve his dream of becoming a WWE Superstar. Can one kid win it all, in the face of epic challengers in the ring? [Netflix]",TV-G,52
423,The Last Full Measure,"Jan 24, 2020","The Last Full Measure tells the true story of Vietnam War hero William H. Pitsenbarger (Jeremy Irvine), a U.S. Air Force Pararescuemen (also known as a PJ) medic who personally saved over sixty men. During a rescue mission on April 11, 1966, he was offered the chance to escape on the last helicopter out of a combat zone heavily under fire, but he stayed behind to save and defend the lives of his fellow soldiers of the U.S. Army's 1st Infantry Division, before making the ultimate sacrifice in the bloodiest battle of the war. Thirty-two years later, respected Pentagon staffer Scott Huffman (Sebastien Stan) on a career fast-track is tasked with investigating a Congressional Medal of Honor request for Pitsenbarger made by his best friend and PJ partner on the mission (William Hurt) and his parents (Christopher Plummer & Diane Ladd). Huffman seeks out the testimony of Army veterans who witnessed Pitsenbarger’s extraordinary valor, including Takoda (Samuel L. Jackson), Burr (Peter Fonda) and Mott (Ed Harris). But as Huffman learns more about Pitsenbarger’s courageous acts, he uncovers a high-level conspiracy behind the decades-long denial of the medal, prompting him to put his own career on the line to seek justice for the fallen airman.",R,51
424,Human Capital,"Mar 20, 2020","As perspectives shift between parents and children, an impulsive business deal brings together two families from across the social divide, with tragic consequences. A real estate agent puts his livelihood at stake with a desperate gamble, a wealthy housewife is confronted with the profound void in her life, and a teenage girl falls deeply in love for the first time.",Not Rated,51
425,Dangerous Lies,"Apr 30, 2020","After losing her waitressing job, Katie Franklin (Camila Mendes) takes a job as a caretaker to a wealthy elderly man in his sprawling, empty Chicago estate. The two grow close, but when he unexpectedly passes away and names Katie as his sole heir, she and her husband Adam (Jessie T. Usher) are pulled into a complex web of lies, deception, and murder. If she's going to survive, Katie will have to question everyone's motives — even the people she loves. [Netflix]",TV-14,51
426,Project Power,"Aug 14, 2020","On the streets of New Orleans, word begins to spread about a mysterious new pill that unlocks superpowers unique to each user. The catch: You don’t know what will happen until you take it. While some develop bulletproof skin, invisibility, and super strength, others exhibit a deadlier reaction. But when the pill escalates crime within the city to dangerous levels, a local cop (Joseph Gordon-Levitt) teams with a teenage dealer (Dominique Fishback) and a former soldier fueled by a secret vendetta (Jamie Foxx) to fight power with power and risk taking the pill in order to track down and stop the group responsible for creating it.",R,51
427,We Can Be Heroes,"Dec 25, 2020","When alien invaders kidnap Earth's superheroes, their kids are whisked away to a government safe house. But whip-smart tween Missy (Yaya Gosselin) will stop at nothing to rescue her superhero dad, Marcus Moreno (Pedro Pascal). She teams up with the rest of the superkids to escape their mysterious government babysitter, Ms. Granada (Priyanka Chopra Jonas). If they're going to save their parents, they'll have to work together by using their individual powers — from elasticity to time control to predicting the future — and form an out-of-this-world team.",PG,51
428,Go Back to China,"Mar 6, 2020","The semi-autobiographical film follows spoiled rich girl Sasha Li (Anna Akana), who after blowing through most of her trust fund, is forced by her father (Richard Ng) to go back to China and work for the family toy business. What begins simply as a way to regain financial support soon develops into a life altering journey of self discovery, as Sasha discovers her passion for toy designing and learns to reconnect with her estranged family. A bittersweet portrait of a fractured family, the film also offers an honest look at the human cost of things that are made in China. [SXSW]",TV-14,51
429,Dolly Parton’s Christmas On the Square,"Nov 22, 2020","A rich and nasty woman, Regina Fuller (Christine Baranski), returns to her small hometown after her father’s death to evict everyone and sell the land to a mall developer - right before Christmas. However, after listening to stories of the local townsfolk, reconnecting with an old love, and accepting the guidance of an actual angel, Regina starts to have a change of heart. This is the story about family, love, and how a small town’s Christmas spirit can warm even the coldest of hearts. [Netflix]",TV-PG,51
430,Lost Transmissions,"Mar 13, 2020","When an acclaimed music producer (Simon Pegg) goes off his schizophrenia medication, his friends chase him though the Los Angeles music scene to help commit him to a psychiatric hospital, revealing the troubling inadequacies of our mental health care system.",Not Rated,51
431,Trolls World Tour,"Apr 10, 2020","Poppy and Branch discover that they are but one of six different Troll tribes scattered over six different lands devoted to six different kinds of music: Funk, Country, Techno, Classical, Pop and Rock. Their world is about to get a lot bigger and a whole lot louder. A member of hard-rock royalty, Queen Barb, aided by her father King Thrash, wants to destroy all other kinds of music to let rock reign supreme. With the fate of the world at stake, Poppy and Branch, along with their friends, set out to visit all the other lands to unify the Trolls in harmony against Barb, who's looking to upstage them all.",TV-G,51
432,Liberté,"May 1, 2020","Just before the French Revolution, in a forest outside Berlin, a band of libertines expelled from the court of Louis XVI rendezvous with the legendary German seducer and freethinker, the Duc de Walchen (Helmut Berger), to convince him to join in their mission: the rejection of authority and all moral boundaries. What begins as an evening of strategizing on the proliferation of libertinage, descends into a Sadean night of pansexual one-upmanship.",Not Rated,51
433,The Christmas Chronicles 2,"Nov 25, 2020","It’s been two years since siblings Kate (Darby Camp) and Teddy Pierce (Judah Lewis) saved Christmas, and a lot has changed. Kate, now a cynical teenager, is reluctantly spending Christmas in Cancun with her mom’s new boyfriend and his son Jack (Jahzir Bruno). Unwilling to accept this new version of her family, Kate decides to run away. But when a mysterious, magical troublemaker named Belsnickel threatens to destroy the North Pole and end Christmas for good, Kate and Jack are unexpectedly pulled into a new adventure with Santa Claus (Kurt Russell). ",PG,51
434,The Wave,"Jan 17, 2020","Frank, an opportunistic insurance lawyer, thinks he's in for the time of his life when he goes out on the town to celebrate an upcoming promotion with his co-worker, Jeff. But their night takes a turn for the bizarre when Frank is dosed with a hallucinogen that completely alters his perception of the world, taking him on a psychedelic quest through board meetings, nightclubs, shootouts, and alternate dimensions. As Frank ping-pongs between reality and fantasy, he finds himself on a mission to find a missing girl, himself - and his wallet.",R,51
