,Title,Date,Summary,Rating,Metascore
100,Relic,"Jul 10, 2020","When octogenarian Edna inexplicably vanishes, her daughter Kay (Emily Mortimer) and granddaughter Sam (Bella Heathcote) rush to their family’s decaying country home and find clues of her increasing dementia scattered around the house in her absence. After Edna returns just as mysteriously as she disappeared, Kay’s concern that her mother seems unwilling or unable to say where she’s been clashes with Sam’s unabashed enthusiasm to have her grandma back. However, as Edna’s behavior turns increasingly volatile, both begin to sense that an insidious presence in the house might be taking control of her.",R,77
101,Small Axe: Alex Wheatle,"Dec 11, 2020","Alex Wheatle follows the true story of award-winning writer, Alex Wheatle (Sheyi Cole), from a young boy through his early adult years. Having spent his childhood in a mostly white institutional care home with no love or family, he finally finds not only a sense of community for the first time in Brixton, but his identity and ability to grow his passion for music and DJ'ing. When he is thrown in prison during the Brixton Uprising of 1981, he confronts his past and sees a path to healing.",TV-MA,77
102,We Are Little Zombies,"Jul 10, 2020","When four young orphans—Hikari, Ikuko, Ishi, and Takemura—first meet, their parents’ bodies are being turned into dust, like fine Parmesan atop a plate of spaghetti Bolognese, and yet none of them can shed a tear. They are like zombies; devoid of all emotion. With no family, no future, no dreams, and no way to move forward, the young teens decide that the first level of this new existence involves salvaging a gaming console, an old electric bass, and a charred wok from their former homes—just enough to start a band…and then conquer the world. ",Not Rated,76
103,Zappa,"Nov 27, 2020","With unfettered access to the Zappa family trust and all archival footage, Zappa explores the private life behind the mammoth musical career that never shied away from the political turbulence of its time. Alex Winter’s assembly features appearances by Frank’s widow Gail Zappa and several of Frank’s musical collaborators including Mike Keneally, Ian Underwood, Steve Vai, Pamela Des Barres, Bunk Gardner, David Harrington, Scott Thunes, Ruth Underwood, Ray White and others.",Not Rated,76
104,The Trial of the Chicago 7,"Sep 25, 2020","What was intended to be a peaceful protest at the 1968 Democratic National Convention turned into a violent clash with police and the National Guard. The organizers of the protest—including Abbie Hoffman, Jerry Rubin, Tom Hayden and Bobby Seale—were charged with conspiracy to incite a riot and the trial that followed was one of the most notorious in history.",R,76
105,The Whistlers,"Feb 28, 2020","Not everything is as it seems for Cristi, a police inspector in Bucharest who plays both sides of the law. Embarking with the beautiful Gilda on a high-stakes heist, both will have to navigate the twists and turns of corruption, treachery and deception. A trip to the Canary Islands to learn a secret whistling language might just be what they need to pull it off.
",Not Rated,76
106,Mucho Mucho Amor,"Jul 8, 2020","Once the world's most famous astrologer, Walter Mercado seeks to resurrect a forgotten legacy. Raised in the sugar cane fields of Puerto Rico, Walter grew up to become a gender non-conforming, cape-wearing psychic whose televised horoscopes reached 120 million Latinx viewers a day for 30 years before he mysteriously disappeared.",TV-14,76
107,Red Penguins,"Aug 4, 2020","Red Penguins tells a story of capitalism and opportunism run amok - complete with gangsters, strippers and live bears serving beer on a hockey rink in Moscow. Shortly after the collapse of the Soviet Union, the Pittsburgh Penguins and the famed Red Army hockey team formed a joint-venture that showed anything was possible in the new Russia. Eccentric marketing whiz, Steve Warshaw, is sent to Russia and tasked to transform team into the greatest show in Moscow. He takes the viewer on a bizarre journey highlighting a pivotal moment in U.S. Russian relations in a lawless era when oligarchs made their fortunes and multiple murders went unsolved.",PG-13,76
108,The Wild Goose Lake,"Mar 6, 2020","When small-time mob leader Zhou Zenong (Hu Ge) accidentally kills a cop, a dead-or-alive bounty is placed on his head, forcing him on the lam from both the police as well as dangerous gangsters out for the reward. Hiding out in China’s densely populated (and deeply divided) Wuhan province, Zhou becomes entangled with a beautiful, enigmatic woman, who has mysterious intentions of her own.",Not Rated,76
109,The Godfather Coda: The Death of Michael Corleone,"Dec 4, 2020","Celebrating the 30th Anniversary of The Godfather: Part III, director/screenwriter Francis Ford Coppola brings a definitive new edit and restoration of the final film in his epic Godfather trilogy—Mario Puzo’s The Godfather, Coda: The Death of Michael Corleone. Michael Corleone (Al Pacino), now in his 60s, seeks to free his family from crime and find a suitable successor to his empire. That successor could be fiery Vincent (Andy Garcia)... but he may also be the spark that turns Michael's hope of business legitimacy into an inferno of mob violence. The film’s meticulously restored picture and sound, under the supervision of American Zoetrope and Paramount Pictures, includes a new beginning and ending, as well as changes to scenes, shots, and music cues. The resulting project reflects author Mario Puzo and Coppola’s original intentions of The Godfather: Part III, and delivers, in the words of Coppola, “a more appropriate conclusion to The Godfather and The Godfather: Part II.”",Not Rated,76
110,Shirley,"Jun 5, 2020","Renowned horror writer Shirley Jackson (Elisabeth Moss) is on the precipice of writing her masterpiece when the arrival of newlyweds upends her meticulous routine and heightens tensions in her already tempestuous relationship with her philandering husband. The middle-aged couple, prone to ruthless barbs and copious afternoon cocktails, begins to toy mercilessly with the naïve young couple at their door.",R,76
111,Howard,"Aug 7, 2020","The story of songwriter Howard Ashman who penned the lyrics for Little Shop of Horrors, The Little Mermaid, Aladdin and Beauty and the Beast before he died of AIDS at the height of the AIDS crisis in 1991.",TV-PG,76
112,The Truth,"Jul 3, 2020","Fabienne (Catherine Deneuve) is an aging French movie star who, despite her momentary lapses in memory, remains a venerable force to be reckoned with. Upon the publication of her memoirs, her daughter Lumir (Juliette Binoche) returns to Paris from New York with her husband (Ethan Hawke) and their young daughter to commemorate its release. A sharp and funny battle of wits ensues between the mother-daughter duo, as Lumir takes issue with Fabienne’s rose-colored version of the past. Reflected cleverly by Fabienne’s latest role in a sci-fi drama, their strained relationship takes a poignant journey toward possible reconciliation. [IFC Films]",PG,76
113,Yourself and Yours,"Jun 5, 2020","When painter Youngsoo (Kim Joohyuk) learns that his girlfriend, Minjung (Lee Yooyoung), was recently seen having drinks with another man, he can’t help but question her about it. It doesn’t go well and they part on bad terms. The next day, Youngsoo tries to find her, but can’t. As he wanders and frets, Minjung has a series of encounters with other men. But to them it seems she’s not herself.",Not Rated,75
114,Farewell Amor,"Dec 11, 2020","After 17 years in exile, Walter finally reunites with his family after being forced to leave Angola for New York City. We meet the family as Walter is picking up his wife, Esther, and daughter, Sylvia, from the airport to bring them home to his one-bedroom Brooklyn apartment. They quickly discover how the years of separation have turned them into absolute strangers. As they attempt to overcome the personal and political hurdles amongst them, they rely on the muscle memory of dance to find their way back “home.” ",Unrated,75
115,José,"Jan 31, 2020","José (Enrique Salanic) lives with his mother (Ana Cecilia Mota) in Guatemala City, where they survive on her selling sandwiches at bus stops and with him working at a local restaurant. It is a poor and sometimes dangerous country where, dominated by conservative Catholic and Evangelical Christian religion, living one’s life as an openly gay man is hard for José to imagine. His mother has never had a husband, and as her youngest and favorite child, though at the edge of manhood at 19-years old, she is determined to hold on to him. Reserved and private, José fills his free moments playing with his phone and random sex with other men arranged on street corners and dating apps. When he meets attractive and gentle Luis (Manolo Herrera), a migrant from the rural Caribbean coast, they pursue an unexpected relationship with more emotion than José has ever felt. He is thrust into new passion and pain, and self-reflection, that push him to rethink his life even as he is reluctant to take a leap of faith.",Not Rated,75
116,Zombi Child,"Jan 24, 2020","Haiti, 1962. A man is brought back from the dead only to be sent to the living hell of the sugarcane fields.  In Paris, 55 years later, at the prestigious Légion d’honneur boarding school, a Haitian girl confesses an old family secret to a group of new friends – never imagining that this strange tale will convince a heartbroken classmate to do the unthinkable.",Not Rated,75
117,Queer Japan,"Dec 11, 2020","Trailblazing artists, activists, and everyday people from across the spectrum of gender and sexuality defy social norms and dare to shine in this kaleidoscopic view of LGBTQ+ culture in contemporary Japan. From glossy pride parades to playfully perverse underground parties, Queer Japan pictures people living brazenly unconventional lives in the sunlight, the shadows, and everywhere in between.
Dazzling, iconoclastic drag queen Vivienne Sato peels back the layers of language and identity. Maverick manga artist Gengoroh Tagame tours the world with his unapologetically erotic gay comics. Councilwoman Aya Kamikawa recounts her rocky path to becoming the first transgender elected official in Japan. At legendary kink-positive hentai party Department H, non-binary performance artist Saeborg uses rubber to create a second skin. Culled from 100+ interviews conducted over 3 years in locations across Japan, Queer Japan features dozens of individuals sharing their experiences in their own words. Get to know a vibrant and inspiring group of human beings in a country with a unique history of queer expression.",Not Rated,75
118,Dirty God,"Nov 13, 2020",A young British mother struggles to reclaim her life after a brutal acid attack leaves her severely scarred.,Not Rated,75
119,Leap of Faith: William Friedkin on the Exorcist,"Nov 19, 2020","A lyrical and spiritual cinematic essay on The Exorcist, Leap Of Faith explores the uncharted depths of William Friedkin's mind's eye, the nuances of his filmmaking process, and the mysteries of faith and fate that have shaped his life and filmography. ",Not Rated,75
120,Hammer,"Jun 5, 2020","A father faces a personal crisis when he discovers his estranged son fleeing a botched drug deal. The two men embark on a violent odyssey that grapples with themes of fatherhood, family and fate.",Not Rated,75
121,Martin Eden,"Oct 16, 2020","Martin (Luca Marinelli) is a self-taught proletarian with artistic aspirations who hopes that his dreams of becoming a writer will help him rise above his station and marry a wealthy young university student (Jessica Cressy). The dissatisfactions of working-class toil and bourgeois success lead to political awakening and destructive anxiety in this enveloping, superbly mounted bildungsroman.",TV-PG,75
122,Diana Kennedy: Nothing Fancy,"May 22, 2020","Diana Kennedy: Nothing Fancy is an intimate, candid perspective into the curious world of cookbook author and British ex-pat Diana Kennedy - widely regarded as the world’s expert on Mexican cuisine. At five feet tall and 97 years old, Diana is larger than life: a foul-mouthed fireball far more feisty and energetic than her age and petite frame let on. Author of nine Mexican cookbooks, she has spent over 60 years researching and documenting the regional cuisines of Mexico. Kennedy has lived ‘off-the-grid’ on an eight-acre ranch outside Zitácuaro, Michoacán since the 1970’s: composting, growing her own crops, and using solar power to run her home. Aware of her own mortality, she is working tirelessly to solidify the legacy of her life’s efforts, with the hope of turning her home into a foundation for culinary education in Mexico. ",Not Rated,75
123,Mayor,"Dec 2, 2020","Mayor follows Musa Hadid, the Christian mayor of Ramallah, during his second term in office. His immediate goals: repave the sidewalks, attract more tourism, and plan the city’s Christmas celebrations. His ultimate mission: to end the occupation of Palestine.",Not Rated,75
124,Heimat is a Space in Time,"Mar 13, 2020","In this immersive film essay, master documentary filmmaker Thomas Heise dives into four generations of his own family archives to trace the profound cultural and political upheaval of Germany's last century.",Not Rated,75
125,True History of the Kelly Gang,"Apr 24, 2020","Set amidst the grueling badlands of 19th-century Australia, legendary outlaw Ned Kelly (George MacKay) grows up under the bloody and uncompromising rule of the English. Food is scarce, survival is filled with daily strife, and every opportunity the colonizers take to make their victims feel powerless is inflicted with searing brutality.  In a desperate attempt to prime him for rebellion, Ned Kelly’s mother (Essie Davis), sells him off into the hands of the notorious bushranger Harry Power (Russel Crowe), where the young bandit discovers he comes from a line of warriors called the Sons of Sieve. Fueled by his roots and a voracious appetite for revenge, Ned Kelly leads an anarchist army to wreak havoc on their oppressors in one of the most audacious attacks the country has ever seen. [IFC Films]",R,75
126,The Kid Detective,"Oct 16, 2020","A once-celebrated kid detective, now 31, continues to solve the same trivial mysteries between hangovers and bouts of self-pity. Until a naive client brings him his first 'adult' case, to find out who brutally murdered her boyfriend.",R,74
127,Children of the Sea,"Sep 1, 2020","When Ruka was younger, she saw a ghost in the water at the aquarium where her dad works. Now she feels drawn toward the aquarium and the two mysterious boys she meets there, Umi and Sora. They were raised by dugongs and hear the same strange calls from the sea as she does. Ruka's dad and the other adults who work at the aquarium are only distantly aware of what the children are experiencing as they get caught up in the mystery of the worldwide disappearance of the oceans' fish.",Not Rated,74
128,Beastie Boys Story,"Apr 24, 2020",Surviving Beastie Boys members Mike Diamond and Adam Horovitz share details on the history of their band and their friendship with director and longtime collaborator Spike Jonze.,TV-MA,74
129,Ghost Town Anthology,"Apr 21, 2020","In the small isolated town of Irénée-les-Neiges with a population of 215, supernatural activities begin to unravel after a man dies in a car accident. The stunned townspeople are reluctant to discuss the circumstances of the tragedy. From that point on, for his family and a handful of others, time seems to lose all meaning.",Not Rated,74
130,The Half of It,"May 1, 2020","A shy, introverted, Chinese-American, straight-A student finds herself helping the school jock woo the girl they both secretly love. In the process, each teaches the other about the nature of love as they find connection in the most unlikely of places.",TV-14,74
131,Sylvie's Love,"Dec 23, 2020","In Sylvie’s Love, the jazz is smooth and the air sultry in the hot New York summer of 1957. Robert (Nnamdi Asomugha), a saxophonist, spends late nights playing behind a less-talented but well-known bandleader, as member of a jazz quartet. Sylvie (Tessa Thompson), who dreams of a career in television, spends her summer days helping around her father’s record store, as she waits for her fiancé to return from war. When Robert takes a part-time job at the record store, the two begin a friendship that sparks a deep passion in each of them unlike anything they have felt before. As the summer winds down, life takes them in different directions, bringing their relationship to an end. Years pass, Sylvie’s career as a TV producer blossoms, while Robert has to come to terms with what the age of Motown is doing to the popularity of Jazz. In a chance meeting, Sylvie and Robert cross paths again, only to find that while their lives have changed, their feelings for each other remain the same. ",PG-13,74
132,The Infiltrators,"May 1, 2020","The Infiltrators is a docu-thriller that tells the true story of young immigrants who are detained by Border Patrol and thrown into a shadowy for-profit detention center—on purpose. Marco and Viri are members of the National Immigrant Youth Alliance, a group of radical DREAMers who are on a mission to stop unjust deportations. And the best place to stop deportations, they believe, is in detention. However, when Marco and Viri attempt a daring reverse ‘prison break,’ things don’t go according to plan. By weaving together documentary footage of the real infiltrators with re-enactments of the events inside the detention center, The Infiltrators tells an incredible and thrilling true story in a genre-defying new cinematic language. [Oscilloscope]",Not Rated,74
133,Assassins,"Dec 11, 2020","The audacious murder of the brother of North Korea’s Supreme Leader Kim Jon Un in a crowded Malaysian airport sparked a worldwide media frenzy. At the center of the investigation are two young women who are either cold-blooded killers or unwitting pawns in a political assassination. ASSASSINS goes beyond the headlines to question every angle of this case, from human trafficking to geo-political espionage to the secretive dynamics of the North Korean dynasty.",Not Rated,74
134,Father Soldier Son,"Jul 17, 2020","This intimate documentary from The New York Times follows one military family over the course of ten years, becoming an intergenerational exploration of the meaning of sacrifice, purpose and American manhood in the aftermath of war.",R,74
135,Circus of Books,"Apr 22, 2020","In 1976, Karen and Barry Mason had fallen on hard times and were looking for a way to support their young family when they answered an ad in the Los Angeles Times. Larry Flynt was seeking distributors for Hustler Magazine. What was expected to be a brief sideline led to their becoming fully immersed in the LGBT community as they took over a local store, Circus of Books. A decade later, they had become the biggest distributors of gay porn in the US. The film focuses on the double life they led, trying to maintain the balance of being parents at a time when LGBT culture was not yet accepted. Their many challenges included facing jail time for a federal obscenity prosecution and enabling their store to be a place of refuge at the height of the AIDS crisis. Circus of Books offers a rare glimpse into an untold chapter of queer history, and it is told through the lense of the owners' own daughter, Rachel Mason, an artist, filmmaker and musician.",Not Rated,74
136,The Ghost of Peter Sellers,"May 22, 2020","In 1973 Peter Sellers, one of the biggest comedy actors at the time, embarked on a pirate comedy for Columbia Pictures. He lost confidence with the film immediately and tried to sabotage it, first firing the producers before turning on his friend (and the film's young director), Peter Medak. Despite an illustrious career and the passing of 43 years since the unraveling production, Medak is still reeling from the disastrous experience and healing the wounds inflicted by Sellers and the film's failure. ",Not Rated,74
137,End of Sentence,"May 29, 2020","After being widowed, Frank Fogle (John Hawkes) reluctantly embarks on a journey to honor his wife's last wish of spreading her ashes in a remote lake in her native Ireland and a promise of taking his estranged son, Sean (Logan Lerman), along for the trip. Between a disconcerting Irish wake, the surfacing of an old flame, the pick up of a pretty hitchhiker and plenty of unresolved issues, the journey becomes a little more than father and son had bargained for.",Not Rated,74
138,Beats,"Jun 26, 2020","Two best friends in a small Scottish town in the summer of '94 who head out for one last night together before life takes them in different directions. Going to an illegal rave, the boys journey into an underworld of anarchy, freedom and collision with the law as they share a night that they will never forget.
",Not Rated,74
139,The Surrogate,"Jun 12, 2020","Jess Harris (Jasmine Batchelor), a 29 year old web designer for a nonprofit in Brooklyn, is ecstatic to be the surrogate and egg-donor for her best friend Josh (Chris Perfetti) and his husband Aaron (Sullivan Jones). Twelve weeks into the pregnancy, a prenatal test comes back with unexpected results that pose a moral dilemma. As they all consider the best course of action, the relationship between the three friends is put to the test.",Not Rated,73
140,On the Rocks,"Oct 2, 2020","Laura (Rashida Jones) thinks she’s happily hitched, but when her husband Dean (Marlon Wayans) starts logging late hours at the office with a new co-worker, Laura begins to fear the worst.  She turns to the one man she suspects may have insight: her charming, impulsive father Felix (Bill Murray), who insists they investigate the situation. As the two begin prowling New York at night, careening from uptown parties to downtown hotspots, they discover at the heart of their journey lies their own relationship.",R,73
141,Miss Juneteenth,"Jun 19, 2020","A former beauty queen turned hard working single mom prepares her rebellious teenage daughter for the Miss Juneteenth pageant, hoping to keep her from repeating the same mistakes in life that she made.",Unrated,73
142,The Fight,"Jul 31, 2020","At this defining moment in American history, The Fight follows a scrappy team of heroic ACLU lawyers in an electrifying battle over abortion rights, immigrant rights, LGBTQ rights and voting rights.",PG-13,73
143,Robin's Wish,"Sep 1, 2020","Robin’s Wish tells the powerful true story of actor/comedian Robin Williams’ final days. For the first time, Robin’s fight against a deadly neurodegenerative disorder, known as Lewy Body Dementia, is shown in stunning detail. Through a journalistic lens, this story sheds an entirely new light on the tragedy, beauty and power behind the mind of one of the greatest entertainers of all time.",Not Rated,73
144,This Is Not a Movie,"Oct 16, 2020","Yung Chang’s This Is Not a Movie captures Fisk in action—feet on the ground, notebook in hand, as he travels into landscapes devastated by war, ferreting out the facts and firing reports back home to reach an audience of millions.  The process of translating raw experience into incisive and passionate dispatches requires the determination to see things first-hand and the tenacity to say what others won’t. In his relentless pursuit of the facts, Fisk has attracted his share of controversy. But in spite of the danger, he has continued to cover stories as they unfold, talking directly to the people involved.  In an era of fake news, when journalists are dubbed “the enemies of the people,” Fisk’s resolve to document reality has become an obsessive war to speak the truth. [KimStim]",Not Rated,73
145,Mystify: Michael Hutchence,"Jan 7, 2020","Deftly woven from an extraordinary archive of rich imagery, Michael’s private home movies and those of his lovers, friends, and family, the film delves beneath the public persona of the charismatic ‘Rock God’ and transports us through the looking glass to reveal a multifaceted, intensely sensitive and complex man. For an all too brief time, we revel in Michael’s Dionysian beauty and sensuality on stage and off. We listen to the range of his extraordinary voice and witness the charmed way he travels through life as he is propelled to world acclaim. But Michael struggled with the idea of success, the creative limits of pop stardom and how to express his integrity; a longing that shaped his life and music and gave birth to a desire to go far beyond the constraints of pop. A violent event strikes Michael and changes his life forever, fracturing his sense of self and robbing him of his connection to life. Made vulnerable, he is unable to navigate the complex challenges he faces moving forward and he has little defence against the onslaught of tabloid press that descends upon his world. Amidst the encroaching darkness, Michael’s new-born daughter, Tiger, becomes his one bright light.",Not Rated,73
146,Hill of Freedom,"Jun 12, 2020","Kwon (Seo Young-hwa) returns to Seoul from a restorative stay in the mountains. She is given a packet of letters left by Mori (Ryo Kase, Like Someone In Love), who has come back from Japan to propose to her. As she walks down a flight of stairs, Kwon drops and scatters the letters, all of which are undated. When she reads them, she has to make sense of the chronology… and so must we. ",Not Rated,73
